{
  "$schema": "https://json-schema.org/draft/2020-12/schema",
  "$id": "https://openquad.dev/schemas/openquad-worker-manifest.schema.json",
  "title": "OpenQuad Worker Manifest",
  "description": "Manifest contract for an OpenQuad worker image. All workers must declare this manifest so the orchestrator can register, route, and apply policy correctly.",
  "type": "object",
  "required": [
    "contract_version",
    "worker",
    "image",
    "template",
    "capabilities",
    "supported_task_types",
    "side_effect_classes",
    "required_env",
    "optional_env",
    "artifact_types",
    "policy_hints",
    "out_of_scope"
  ],
  "additionalProperties": true,
  "properties": {
    "contract_version": {
      "type": "string",
      "const": "openquad.worker.v0.1"
    },
    "worker": {
      "type": "object",
      "required": ["name", "description"],
      "properties": {
        "name": { "type": "string" },
        "description": { "type": "string" }
      },
      "additionalProperties": true
    },
    "image": { "type": "string" },
    "template": { "type": "string" },
    "capabilities": {
      "type": "array",
      "minItems": 1,
      "items": {
        "type": "object",
        "required": ["name", "task_types", "side_effect_classes"],
        "additionalProperties": true,
        "properties": {
          "name": { "type": "string" },
          "description": { "type": "string" },
          "task_types": {
            "type": "array",
            "items": { "type": "string" },
            "minItems": 1
          },
          "side_effect_classes": {
            "type": "array",
            "items": { "type": "string" }
          },
          "artifact_types": {
            "type": "array",
            "items": { "type": "string" }
          },
          "policy_hints": { "type": "object" },
          "context_profiles": {
            "type": "object",
            "description": "Named context/cost profiles that define token and call limits for tasks under this capability. The orchestrator selects the appropriate profile based on expected task size.",
            "additionalProperties": {
              "$ref": "#/$defs/context_profile"
            }
          }
        }
      }
    },
    "supported_task_types": {
      "type": "array",
      "items": { "type": "string" },
      "minItems": 1
    },
    "side_effect_classes": {
      "type": "array",
      "items": { "type": "string" }
    },
    "required_env": {
      "type": "array",
      "items": { "type": "string" }
    },
    "optional_env": {
      "type": "array",
      "items": { "type": "string" }
    },
    "artifact_types": {
      "type": "array",
      "items": { "type": "string" }
    },
    "policy_hints": { "type": "object" },
    "out_of_scope": {
      "type": "array",
      "items": { "type": "string" }
    },
    "context_profiles": {
      "type": "object",
      "description": "Worker-level default context/cost profiles. Capability-level profiles override these.",
      "additionalProperties": {
        "$ref": "#/$defs/context_profile"
      }
    }
  },
  "$defs": {
    "context_profile": {
      "type": "object",
      "description": "Defines context window, token budget, and tool-call limits for a named task profile.",
      "additionalProperties": true,
      "properties": {
        "description": {
          "type": "string",
          "description": "Human-readable summary of what this profile is designed for."
        },
        "max_single_prompt_tokens": {
          "type": "integer",
          "minimum": 0,
          "description": "Maximum tokens that may be sent to a model in a single prompt call. 0 means no model calls are made (deterministic-only). Inputs larger than this must be chunked or stored as artifacts and summarised."
        },
        "max_total_task_tokens": {
          "type": "integer",
          "minimum": 0,
          "description": "Maximum cumulative tokens across all model calls for the entire task. 0 means no model calls are made (deterministic-only). Enforced by the worker before submitting any model call."
        },
        "max_model_calls_per_task": {
          "type": "integer",
          "minimum": 0,
          "description": "Maximum number of LLM/model API calls this task profile may make. 0 means deterministic-only (no model calls)."
        },
        "max_tool_calls_per_task": {
          "type": "integer",
          "minimum": 0,
          "description": "Maximum number of deterministic tool calls (pdftotext, qpdf, ocrmypdf, etc.) across the task."
        },
        "artifact_first": {
          "type": "boolean",
          "description": "If true, the worker must store the full input as a task artifact before doing any processing. No full-document content is passed directly into model prompts."
        },
        "chunking_required": {
          "type": "boolean",
          "description": "If true, the worker must chunk the input before model processing. Applies to large documents that exceed max_single_prompt_tokens."
        },
        "preferred_model_class": {
          "type": "string",
          "enum": ["none", "fast", "balanced", "capable", "reasoning"],
          "description": "Hint to the orchestrator about which model tier should process this task profile. 'none' means deterministic tools only."
        },
        "deterministic_tools_first": {
          "type": "boolean",
          "description": "If true, the worker must exhaust deterministic tool options before making any model call."
        }
      }
    }
  }
}
